<?xml version="1.0" encoding="UTF-8" ?>
<phoneNumbers 
xmlns:xsi="http://www.w3.org/2001/XMLSchema-instance" 
xsi:noNamespaceSchemaLocation="phoneNumbers.xsd">
    <title>Phonebook</title>
    <entries>
        <entry>
            <name gender="female">
                <first>Kritika</first>
                <middle>Rajya laxmi</middle>
                <last>Shah</last>

            </name>

            <phone>+977 9860783944</phone>
            <city>Durbarsquare</city>

        </entry>
        <entry>
            <name>
                <first>moneey</first>
                <middle>Rajya laxmi</middle>
                <last></last>

            </name>

            <phone>29u98u298u2</phone>
            <city>eiiff</city>

        </entry>

    </entries>
</phoneNumbers>